{
  "diagnostics": [],
  "events": [
    {
      "kind": "scene-load",
      "scene": "Main",
      "seq": 0
    },
    {
      "after": "after",
      "before": "before",
      "id": "label-a",
      "kind": "object-write",
      "property": "text",
      "seq": 1
    }
  ],
  "finalState": {
    "instances": [
      {
        "id": "label-a",
        "object": "Label",
        "text": "after"
      }
    ],
    "scene": "Main"
  },
  "fixtureId": "builtin-text-object",
  "gdevelopRevision": "23f965f5290c176de3666cca9f5ae82ffa70e24a",
  "hostInputs": {
    "clockStartMs": 0,
    "elapsedTimeMs": [
      16
    ],
    "inputEvents": [],
    "locale": "en-US",
    "randomSeed": 123456789
  },
  "run": 1,
  "schemaVersion": "1.0.0"
}
